Post_Id,Text,Lable
post_07094,"i feel like a burden and a failure lately, i've been drowning in this deep, suffocating ocean of despair. my family looks at me with disappointment in their eyes, as if i'm just a burden weighing them down. every day feels like a battle that i'm losing more and more. the loneliness is crushing, the pain unbearable. i've tried therapy, medications, reaching out to friends, but nothing seems to make this feeling go away. i feel like no matter what i do, i end up failing at it.  the world feels so heavy, like i'm carrying the weight of the universe on my shoulders. i can't shake off this feeling of worthlessness and hopelessness. it's like there's a dark cloud following me wherever i go, whispering words of self-hatred and despair into my ears. i don't see a light at the end of this tunnel, just an endless abyss of emptiness.  i'm tired of pretending that everything is okay when it's not. i'm tired of being strong when all i want to do is crumble. i don't see a way out of this misery, and the thought of ending it all seems like the only escape. i just wanted to put these thoughts out there, even if no one listens. i pray for some kind of relief, some kind of peace, but right now, it feels so far out of reach.",1
post_06985,"tired of pretending everything is okay lately, i've been struggling more than ever. it feels like no matter what i do, the darkness keeps creeping back in. i try to keep up with work, exercise, take care of my health, and attend therapy, but nothing seems to make a real difference. the weight of my loneliness, trauma, and past experiences is suffocating me.  i feel like i'm just existing, not really living. the thought of ending it all crosses my mind more often than i care to admit. i've been through so much pain, and i question if there's even a way out of this misery. it's like i'm stuck in a cycle of despair, unable to see a future worth fighting for.  i wish i could find peace, a purpose, some flicker of hope to hold on to. but it feels like i'm running on empty, and the idea of giving up becomes more tempting each passing day. i want to believe that things will get better, but right now, it's hard to see beyond the darkness that surrounds me.",1
post_07370,"lost in the darkness i feel like i'm drowning in a sea of pain and sadness, and no matter how hard i try to swim to the surface, i can't seem to find my way out. it's like there's a heavy weight on my chest, crushing me with every breath i take. i've been fighting these demons for so long, and i'm so exhausted.  every day feels like a struggle just to exist. i put on a brave face for everyone around me, pretending like everything is okay, but inside, i'm falling apart. the loneliness is suffocating, and the thoughts of ending it all keep creeping back into my mind.  i wish i had the courage to just let go, to escape this never-ending cycle of pain and despair. but then i think about the people i would leave behind, the ones who care about me, and the thought of hurting them stops me every time.  i just want someone to understand, to hold me and tell me that everything will be okay. but it feels like i'm trapped in this darkness all alone, with no way out. i'm tired of struggling, tired of pretending. i just want the pain to end.",1
post_00743,"“you have no choice but to keep fighting.” oh, but i do. i do have a choice i’m sick of people telling me i have no choice but to get better. what they don’t realize is i always have the option of suicide. so yes, i do have a choice. i’ll always have that choice. 
stop 👏 making 👏 us 👏 live 👏 just 👏 for 👏 your 👏 happiness 👏",1
post_02723,"i've lost any and all hope. i don't think i can be helped. today, me and my dad worked on a plan to help me, i'd go to a psychiatrist, have a discussion with the school about how to make it more bearable without just quitting. i'd work on my mood swings, everything would be okay, i had hope that this would work. 

then we called my mom and she basically said (in more sophisticated wording) 'fuck you, no, indigo doesn't have it that bad, she said she wanted group therapy a while back, and i don't like that psychiatrist.' i'm done, that was my very last attempt at getting better. it's over for me. i'm not having that discussion at school anymore, i'm not going to the psychiatrist, i've tried everything that's possible for me.",1
post_07774,"feeling hopeless and trapped in a toxic environment i don't even know where to begin. every day feels like a struggle, and the weight of my thoughts is crushing me. i'm surrounded by negativity and toxicity, and i just can't see a way out. my family situation is a mess - constant fighting, emotional abuse, and no support system to lean on. it's like being stuck in a never-ending nightmare, and i'm so tired of pretending that everything is okay.  i've reached out for help, but it feels like nobody really understands the depth of my pain. i've seen therapists, talked to friends, but the darkness just keeps creeping back in. the thought of ending it all has crossed my mind more times than i can count, and it's starting to feel like the only way out of this endless cycle of despair.  i know there are people who care about me, who would be devastated if i were to give up. but it's hard to keep going for them when i feel so empty inside. i feel like a burden, like my problems are too much for anyone to handle. i just want the pain to stop, even if it means taking drastic measures.  i guess i'm just looking for a glimmer of hope, a sign that things can get better. but right now, it's hard to see past the darkness that surrounds me. i want to believe that there's a way out of this, but right now,",1
post_06243,"my high school bully died today. everyone is making the typical “rip gone to soon” posts on social media.

i want to comment…

“rest in peace asshole. will never forget the day you punched me in the chest out of nowhere then shoved my half conscious body into my locker or the day you put me in a trash can and held the lid over the trashcan for 5 minutes while i begged for my life.”

be nice to ppl for fucks sake. this asshole had it coming & i am glad  karma finally caught up with him. 

there i said it. off my chest. fuck you asshole.",0
post_04449,"i feel like i was finally in a really good place before this pandemic and now its getting bad again. anyone else? I had worked so hard to find peace and stability in my life, only for the pandemic to disrupt everything. It feels like all my progress is slipping away, and I'm struggling to hold on. Can anyone else relate?",0
post_05890,my country is dead (usa) i just learned mitt romney endorsed confirming a supreme court judge before the election. i am fucking done with my country. the christian right has officially hyjacked the usa. their motives by definition are against my constitution (separation of church and state). i am not a christian i do not feel safe living in a country that uses the bible to write policy. the front runner for the supreme court seat wants to live under christian rule. if you support anything the gop has done fuck you.,0
post_02595,"the people around me shouldn't make my desire to die all about them i'm 26. i've been an adult for years. things have never gotten better. just so much worse. and lonelier. i've tried every trick in the book. taken tons of meds for years. been to the psych ward. i've been in therapy since i was 14. it doesn't work out for all of us, and some of us are tired.

i should be allowed to say i want to die without people making it all about them. i should be able to vocalise my pain without everyone around me calling me ""selfish"" for not wanting to live on in absolute agony. suddenly, i'm the bad guy for not wanting to wake up crying every morning? i don't get it.

i personally believe it is selfish for others to want a suicidal person to live on. how fucking selfish do you have to be to see someone in an incredible amount of pain, and want them to live on. we don't even do this shit to animals, so why do we do it to humans? 

life fucking sucks. ",1
post_06999,"feeling lost and alone lately, everything just feels like it's falling apart. i've been struggling with loneliness, anxiety, and the weight of past traumas that just won't seem to go away. it's like there's a constant dark cloud hanging over me, and no matter how hard i try, i can't seem to shake it off. the thought of ending it all has been creeping into my mind more often than i'd like to admit. i feel like i'm drowning in a sea of despair, and i just can't see a way out. i wish someone would reach out and show me that there's a glimmer of hope left because right now, i feel like i'm barely holding on.",1
post_03131,"major anxiety this morning i had a work incident take place on saturday afternoon right before my shit ended and my work week ended.

i went from being in a fantastic mood to really frustrated and struggling with a ton of self doubt.

luckily i was able to calm down over the weekend, but this morning my body went into anxiety attack mode on the way to work and i had to turn around.  

i have a long history of low self esteem and i have tried to work really hard on that.  the incident at work was all negative, and i work really hard at my job, so it was frustrating to take all the negatives and my self doubt really came back.  i was able to cry and let a ton of emotion out.

in the past i drank extremely heavily and used other substances to numb everything, that only made things a million times worse.  i'm trying to work through everything and not go down that path.

sometimes its a constant back and forth and i know i'm really good at my job, but then i have times where the negative past comes creeping back in, and that's tough to handle.

",0
post_05022,how can i tell is she is into me me (m) and a girl i sit next to never really talked i one day saw her staring at me thought she was day dreaming but after a week of this happening in class i decided to move my head in her direction but she looks away away so is she into me or smth we never really talked before,0
post_00977,"mental illness and too much stress - i want to kill myself hi everyone,

i've had really bad experience with reddit since it feels like whenever you aren't asking something very obvious and actually talk about your unique experience you get downvoted into oblivion, but nevertheless i'll try to explain my situation as honestly as possible so strangers on reddit might be able to help me.

i don't want to sound like a pretentious prick, but i actually think most would consider me in a good position in life - at least that's what everyone tells me. i'm young (16m) and have a bright future to look forward to. i have high grades (a+s consistently), a good sense of direction and maturity/responsibility, and i'm fairly socially vibrant. i also have a good career basically lined up with a full-time job offer in my country's federal government (originally an unpaid co-op/internship i did last year in 2024 but i have an offer to begin working in the spring when i'm wrapped up a few classes), and i'm graduating this year and will start university at 16 (i'm on track to getting my law license at 21 at this rate). i also work a decent part time job at a tutoring centre and i have a few (not many) friends i can occasionally fall back on.

however for the past few months i've been grossly unhappy to the point of being psychiatrically hospitalized with frequent contemplations of suicide. the counsellors and teachers i've spoken to have tried to convince me that stress is the root cause and i should simply scale back - what they don't know is that'd cause me way more trouble since i honestly generally find comfort in work. also trying to scale back at something which i've worked so hard to build and create would honestly be more disheartening. i do really think stress is a big factor but it's not like taking away the things i've worked so hard for is going to make me any more happier. 

for as long as i can remember i've struggled a lot with overthinking and anxiety yet i find nobody is taking me seriously whenever i try to seek help. whether it was writing homework or checking the door - i always double, tripled checked everything. somehow i've been able to get along fine in my life without it. however to be honest i've had instances of severe bouts of anxiety, depression, and paranoia. when i was 11 or 12 i freaked out after finding out a rare instance of canadian law which could make some of my favorite animes illegal (i thought i could have my life or my family's life could be ruined for child pornography possesion). when i was 13 i had a friend who expressed to me distressing thoughts and i freaked out thinking that something could happen with this guy and to me/family. today i constantly compare myself to others even to the point of irrationaility. for example, i frequently feel ashamed of myself and my achievements thinking everyone else is better than me - most of the time because they are 1 year older/ahead of me. even when i know they are older, i still second guess and start asking questions/googling around to the point that a lot of people think i'm a maniac. i've tried to tell myself i'm doing good and not to compare myself to others, but it's no use and i'm still losing my mind. recently i've been finding that it's been increasingly increasingly difficult for me to focus and do my work, and i might finish one class with a failing mark. a lot of people say i'm being burnt out and while that might be one facet of it, i don't believe it's the entire story and i don't know how to help myself. ",1
post_07033,"feeling lost and alone it's like everything around me is crumbling, and i'm just standing in the midst of the chaos, feeling completely lost and alone. the weight of the world on my shoulders is getting heavier each day, and i can't seem to find a way out of this deep, dark hole i'm in.  i see others finding happiness in the simple things, but all it does is remind me of the emptiness i feel inside. the thought of ending it all crosses my mind more often than i care to admit. it's like a constant battle between wanting the pain to stop and not wanting to hurt the ones i love.  i long for peace, for a place where i feel accepted and loved, but right now, it feels like an impossible dream. i don't know how to keep going when every day feels like a struggle just to survive. i'm reaching out here because i have nowhere else to turn, hoping to find some solace in this darkness that surrounds me.",1
post_01259,"wondering if i did the right thing today i’ve been suicidal for most of my life, but in the past several months it has been intensifying. today, i told my endocrinologist, who i trust, that i was suicidal and had been considering a method for it. well, it was more like i unraveled in front of her as she coaxed the answers out of me, but whatever.

she walked with me to the er (which meant a lot even if she was just doing her job). i was only there for about 4 hours. i may have downplayed the severity of my ideation out of fear of being admitted. the psychiatrist determined that i did not need to be forced to be hospitalized but could choose to if i felt it was needed. i said no, though now i’m wondering if i should’ve said yes. i was discharged with mental health resources.

one part of my mind is gently telling me that i did the right thing, that i can use those resources to get better, but the other part is so loud. it is screaming that i fucked up, that it’s pointless and i will end up killing myself anyway because i didn’t tell the whole truth, that i don’t deserve help.

not sure how to feel right now.",1
post_07649,"feeling completely lost and worthless hey everyone, i just need to vent. lately, i've been feeling completely lost and worthless. it's like no matter how hard i try, nothing seems to go right. everything i touch turns to dust, and i can't shake off this overwhelming feeling of failure.  i keep replaying all my past mistakes in my head, and it's eating me up inside. i feel like a burden to everyone around me, like i'm just taking up space. i don't see a light at the end of the tunnel, and the thought of continuing to live like this is suffocating.  sometimes i catch myself fantasizing about ending it all. i envision how it would play out, who would be affected, and the aftermath. it's a dark place to be in, and i feel like i'm sinking deeper with each passing day.  i know i shouldn't give in to these thoughts, but it's hard to see any other way out. has anyone else felt this way? it would mean a lot to know i'm not alone in this unbearable pain.",1
post_05715,"life happened yet again i am going through an extremely tough time. i was diagnosed with cancer some months ago, had a surgery and now have a couple of days before the next stage of treatment starts -- including the most dreaded part -- chemotherapy. my life has been chaotic since the diagnosis, to say the least. simultaneously, i had been giving job interviews, phd interviews, and trying to manage many other things in my life. i actually gave a job interview in the same week as my surgery, and i wondered at the same time where do i get this courage from -- if it was courage. kudos to me?!

all in all, i just needed a space to dole out my feelings as i am too overwhelmed right now. psychology sessions can only help to some extent and the efforts have to be majorly my own to overcome, heal, and bounce back.

i have many good things also happening and existing in life and i am so grateful to the universe for that. so i am not entirely a sobbing tool all the time. i was happy before the diagnosis, i am happy now too for all the good things and supportive people in life, and i am also sad.",0
post_01555,"my girlfriend and best friend left me and i just have no reason to continue a few days ago my girlfriend broke up with me because she can't take my interests in games and writing. i just lost any hope at that moment 

but soon enough, a person i cared most of all and always shared everything with just told me he's drained because of me just enjoying talking with him and blocking me everywhere.

at this point i am tired of people hating autistic gay person i am and i just want to finish this all soon...

",1
post_00206,why my post was deleted? hello. i would like to know why my post got deleted.,0
post_02251,"i thought it was over. i had my first treatment of ect on monday of last week, and i immediately felt my depression go away along with my (what i now realize are) fnd symptoms. i thought i'd be able to stop treatment as soon as i felt better, but they told me i had to taper off for the effect to last. 

i thought the pain was over, that the effect would last at least a few months, but after each treatment this week i've felt my mood and fnd slipping back to where it came from. it doesn't help that the nurses are mean, and don't believe anything i say. they told my mom they felt sorry for her, and told me i was ""believing everything i read on the internet"" for being worried about ect's effect on memory.

i thought it was over, and now i'm at the lowest i've ever been. i guess i forgot i had bipolar disorder. i want the pain to end so bad.",1
post_00333,"3 months so i've been married for 11 years  now divorced my ex wife i don't fault her, but my baby mama sure scares people away even future lovers i can't get dates when they find out i'm the father to one of her kids. and she took my children away from me my social group won't talk to me. i reach out to no one but when i was needed i was there. i keep trying to rebuild but get the reminder that i don't make enough i don't look good enough,  i'm almost 40 and i don't have what i built up anymore and i take care of people for a living.but i'm not even living anymore. ",1
post_01766,"wife cheated update edit: so i've been getting a lot of dm's asking how i caught her etc and what i did. so i came back from a late night jog as i find it peaceful and relaxing as the streets are empty, i came back home to have a shower of course as i was sweaty as fuck. i entered the apartment and just headed to the bedroom and there is where i saw her with another man in bed. my god damn silk sheets tainted by them 😔😂, but yeah it's weird cause i thought i would lash out but i was unusually calm about it. i told the guy to leave and he was literally shitting himself and scrambling to pick up his belongings, like this guy is literally tripping everywhere. 

i think he was afraid as i was just very calm and he didn't expect it. anyway i spoke to my wife asking how long it's been happening and she told me who he is etc, it's a childhood ""friend"". after that i went to the train station which is where the first post came in.

edit 2: people are also asking how long we were together. so i met my loyal and faithful wife at 14 and we got married at 20. so in total that's 12 years of faithfulness from the amazing wife. 

edit 3: holy shit whoever gave the platinum thanks so much???

edit 4: people are surprised that i'm over this so quick and i'm calm about it, i guess it's down to the fact i live by the rule that is ""the pains compulsory, sufferings optional""

original post: https://www.reddit.com/r/suicidewatch/comments/gt620f/wife_cheated/?utm_medium=android_app&utm_source=share

so it's been about 10hours since i posted this and honestly thank you so much everyone for all the support and comments. 

i'm not going to lie when i posted the previous post i was at the train station just waiting to jump infront of one but as stupid as it sounds the comments honestly helped. 

i've now kicked my wife out of our apartment and the bed that she was sleeping with the guy in, i have now burnt. which kinda sucks as it was a king sized bed with silk sheets and everything but i wouldn't have even been able to sleep in those cheat stained sheets now no matter how much i scrub them. 

it felt good tho to actually burn it cause it was letting things go, i've cleared out all the things that reminded me off her and basically smashed it up so kinda like smash therapy and it felt amazing. 

her parents know that she cheated on me cause she tried to spin it that i cheated on her however we have cameras in our apartment and i just sent them the videos 🤷🏽‍♂️.

now her family has pretty much disowned her which i feel like it may be a bit too much even though she is a shitty person but honestly i couldn't care less.

i'm free, feeling a bit shit but i know i'll be happier and honestly if it wasn't for you guys i probably wouldn't be here. 

thank you so much everyone, especially the dude that was talking about pasta 😂",0
post_00289,"an old friend of mine just posted a suicide note and i don’t know what to do fuckkkkkk was friends with him for a short time while living in a group home, but he went to a tougher group home because he had loads of problems in his life (i’ve been caught in those problems too, i can’t really explain it all in this) and since he went we didn’t have much contact and now he posted a story in which he said he’s jumping in front of a train and the time he gave was 2 hours ago fuuuuuuckkkkk what the fuck do i do

edit: since more people keep still reading this post, i’m giving you the update also here: he changed his profile picture so i’m 99% sure he’s at least alive, and there’s nothing more i can do in this situation anymore. i want to thank you all for your care about this situation at least too. 🙏",0
post_04133,"you ever get so anxious that you start writing a comment and literally can't get yourself to send it, even though it's on reddit and reddit is anonymous, and nobody would care? like, really? what is happening to me today?  


  
sorry if this is cringey, but i really didn't think this would be the post to get me past 1k karma... probably not a good thing, but thank you guys.",0
post_04420,"i honestly hate it when people tell you to ""stop being anxious"" or ""there's no need to be anxious"" as if being anxious is something you chose for. edit; i've read every singe comment, and reading all new ones too. sending everyone hugs :)",0
post_03963,"i painted health anxiety... at least how it feels to me. I painted health anxiety, the constant worry, the tightness in my chest, the never-ending cycle of what-ifs. It's my attempt to capture the overwhelming fear and uncertainty that consumes me daily.",0
post_01911,"i'm mentally ill and there is no cure. this is a throwaway account. i'm not much of a writer but i'll try. 

i've been diagnosed with schizophrenia last year. i've been on countless medications and seen numerous psychiatrists. nothing is helping. suicide feels like the only option, a promise of release from the continual weight of hopelessness. i've not much else to say, but i feel compelled to acknowledge the shadow it'll inevitably cast over my loved ones. i'm trapped in a cycle of sorrow. my life is one of nothing but hallucinations, paranoia, and sleepless nights. i'm irreparable, even if circumstances were to improve in the interim, i know i'll find myself in the same unavoidable psychotic abyss. the voices of doubt drown out any sign of hope, leaving me hollow, lost. i’m sorry for the pain this decision will inevitably cause, but the burden has become too heavy to bear.

thanks to whoevers reading this 

au revoir ",1
post_06390,"i'm sitting at my desk at work having a miscarriage i've got no one to talk to about it and couldn't call off today. so here i sit, doing paperwork through tears and feeling completely alone. at least i have some distraction.",0
