Post_Id,Text,Lable
post_06751,"my grandmother was a “secret covid nursing home death” and i want to scream at someone tl;dr - grandma was a ward of arizona due to mental capacity, died of covid in nursing home who hid it from my dad. 

my paternal grandmother was a schizophrenic, since my father was a boy. i didn’t have much of a relationship at all with her, living in another state and her mental capacity being so degraded. she became a ward of the state of arizona back in the 1980’s, when my dad was 15. she’d sometimes have clarity moments, when she’d know who my dad was when he would call…most of the time, she didn’t know anyone.  

fast forward to covid - her healthcare facility/nursing home had the virus take about 40 lives, including my grandmother.  

and they didn’t inform my dad.  

so when he called to speak with his mother, the woman who answered said “oh dear, you were lori’s son…”. this is how my dad learned his mother passed. by a slip of the tongue. then, he gets told that she died weeks ago. and no one called him, they threw out her personal belongings.  

and misplaced her cremated remains. 

i am so angry, so hurt for my father. arizona literally threw away his mother. she may have been “a crazy person”, but she was kind. talented. funny. she was a fucking person who deserved better than to be swept under a rug.",0
post_07382,"lost in the darkness lately, i've been consumed by thoughts of ending it all. it's like a constant background noise, always there no matter how hard i try to push it away. i feel like i'm drowning in a sea of despair, and there's no way out.  my family doesn't understand what i'm going through. they tell me to just be happy, to be grateful for what i have. but it's not that simple. the weight of my pain is crushing me, suffocating me. i feel like a burden, like i don't deserve to take up space in this world.  i've tried reaching out for help, but it feels like no one truly understands the depth of my despair. every day is a battle, and i'm so tired of fighting. the darkness whispers that the only way to end this pain is to end my life. and sometimes, in my weakest moments, it's a tempting idea.  i don't know how to escape this cycle of hopelessness. i feel so lost and alone, like no one can see the real me behind the facade i put up every day. i just want the turmoil to end, to find peace in a world that seems determined to break me.",1
post_04347,"anyone’s anxiety so bad that they sometimes question whether or not they actually have anxiety or if you’re making it up? I often find myself caught in this overwhelming cycle of doubt, wondering if my anxiety is just a figment of my imagination. The constant battle between my mind and my emotions can be exhausting, leaving me feeling lost and alone in my struggles. It's a lonely place to be, questioning the validity of my own experiences.",0
post_06606,"nurses laughed at me and it made me happy when they panicked  so this is just a rant because it bothers me. i ""won"" in the end but i don't really know who talk to about this. but i just gotta get it off my chest how happy i was to be proven right.

so i went to the er because i had a fever i couldn't get down and felt like i couldn't breathe. when i approached the counter and explained what was going on two nurses who were sitting behind her snickered and laughed. one said to the other in a low voice ""she could at least try harder"" and the nurse at the counter rolled her eyes, smiled and said ""okay sweetie well you can breathe okay"" i'm not really sure why they responded that way. maybe i looked like someone else? but it took them 2 hours to check my temp and blood pressure and when i approached they gave me attitude. only to find out i had a temperature of 104, low blood pressure, a heart rate of 148, and my oxygen level was at 85. the lady said ""did you drive yourself here? you must be having a hard time breathing."" i looked at her and said ""crazy right? it's almost like it's almost like it's why i came here"" 

i'll be honest i did get a satisfaction of seeing their response! i got admitted shortly after and was hospitalised for a bit. but man i got so happy seeing the fear in their eyes!",0
post_02459,holding on idk why i still hold on but i keep on. i really just want to be dead. i betrayed everyone i love and i will never forgive myself. it’s been over a year. my anxiety and depression has been 24/7 no breaks i am in the worst place financial. i’m just really disappointed in my past actions and i can’t fix them. so i’d rather just restart a new life. i’ve always wondered what it was like to be someone else anyway ,0
post_04906,"smoked & drank from 13yrs to 21.  sober for an year now feeling proud but also sad as i lost touch with lot of friends too.

but now i have nothing to hide from my parents and don't have to sneak and check if my breath smells alcohol or not.

just working the whole day and just doing things.

now i realised those friends who were really close with me and were good in academics slowly become distance from me once i started having these kinds of habits.

lost so many friends, so many times almost got caught but no more of those things anymore for whole 1 year.

it was hard but kept trying and one day i just decided to not drink and just stick on it till now.",0
post_00271,"i was gang raped at 10 and cant get over it im 14(f) and was gang raped by my very first group of friends.
at 6 i was raped by my brother and that already affected me, the group knew how much it hurt me, but they did it anyway.
that group was the first group i came out to as gay, and there was one other girl (13)
the guys (17,15,13,13,12) used her against me.
that girl was my childhood best friend, i related to her more than anyone else.
i cant sleep at night because i can feel their ""fluids"" on my face, on my body, in my hair, in my mouth, in my eyes,
i can taste it.
im horrified.
i feel so disgusting and all i feel is it dripping off my skin,
i hate how fast my heart beats.
everynight i have flashbacks and non stop panic attacks.
i haven't told anyone, not even my parents. they only know ""something"" happened but they didnt believe me, and they said even if it did happen it was my own fault.
one of the guys keeps texting me and everytime i block him he makes a new account. he triggers me so badly.
im so tired and just want to die.
it hurts so bad and theres so many other things taht make me want to just leave.
i was severely bullied through the ages of 4-13, and never had any friends. this group was the very first to group to ever like me. ive now moved schools and its actually a lot better, but the effects of literally everyone hating me still linger. i still remember vividly when a guy stomped on my foot so hard it broke, or getting slush slammed into my face, or getting shoved down stone stairs, or getting dragged by the hair. i remember hearing what people would say about me, and now thats all i can think about. what people might be thinking about me, or what they want to do to me. im sick of feeling everyones eyes on me. im sick of always feeling judged. it feels like everyone around me can see the handprints of the group still on my body. i just want to sleep, i want to sleep so so bad. ive been awake for 40 hours and i doubt ill manage to get sleep tonight. im so tired.

im sorey about how messy this is but im so scared i just want to leave please help me im so tired",1
post_04172,fuck anxiety that is all ,0
post_02551,"im hollow inside i feel so hollow and empty. i genuinly despise life, i can not, as hard as i try, imagine a future in my life that i enjoy. i hate the job i have now, i hated life just as much when i didnt have a job, i cant imagine any other job i could have where i could be at least satisifed in life. even the idea of just living in the woods doesnt appeal to me anymore, just the idea of having to see tomorrow feels like a bad dream, like its not even real. 

i really just hope that i get some terminal illness or something, otherwise i dont know what ill do.",0
post_04144,"i feel good right now. i may or may not feel good tomorrow, but goddamnit i feel good and in control today and i'm proud of that I've struggled with my mental health, but today I feel like I am finally winning the battle. I may not know what tomorrow holds, but right now, I am proud of myself for feeling good and in control. It's a small victory, but it means everything to me.",0
post_07586,"struggling to find a reason to keep going lately, it feels like the weight of the world is crushing me. every day is a battle to even get out of bed and face the world. i feel like i'm drowning in my own thoughts, suffocating in loneliness and despair.  my family situation is a mess, filled with toxicity and constant criticism. i can't remember the last time i felt truly loved or supported. it's like i'm living in a constant state of emotional turmoil, and i can't see a way out.  work has been unbearable, and i feel like i'm slipping further and further behind. the pressure to perform, to keep up appearances, it's all becoming too much. i've started to isolate myself even more, pushing away friends and colleagues, just so i can hide how broken i really feel inside.  i've been having these dark thoughts, thoughts of ending it all. the idea of not having to face another day of this endless pain seems almost comforting. but a part of me is still holding on, desperately searching for a glimmer of hope in this sea of darkness.  i don't know where to turn or who to talk to. i feel lost and alone, trapped in this cycle of despair. if you're reading this, please know that i'm struggling, and i just need someone to hear me, to see me, before it's too late.",1
post_07497,"feeling trapped in a world of darkness lately, the weight of everything is just too much to bear. it's like i'm drowning in a sea of despair, and there's no one around to throw me a lifeline. the pain, the loneliness, the hopelessness - it all feels suffocating. i can't see a light at the end of the tunnel, just darkness.  every day is a struggle to keep going, to put on a brave face for the world. but deep down, i feel like i'm crumbling inside. the thoughts of ending it all keep creeping into my mind, whispering that there's no way out of this misery. i just want the pain to stop, to find peace in the silence of death.  i've tried reaching out for help, but it feels like no one truly understands the depth of my suffering. it's hard to explain the emptiness that consumes me, the endless cycle of sadness and despair. i feel like a burden to those around me, like my existence only brings pain and disappointment.  i know people say suicide is a permanent solution to a temporary problem, but what if the problem feels eternal? what if the darkness never lifts, and the pain never fades? i'm tired of fighting, tired of pretending that everything will be okay. i just want the unbearable pain to end, once and for all.",1
post_04401,"it took me years to realize my anxiety was anxiety and not just my personality. i only came to this realization recently and it's weird that it took so long when anxiety runs in my family. my mom's been hospitalized for panic attacks. i've had depressive bouts but every time i heard someone mention anxiety, my brain was like ""hmmm. not me."" 

&#x200b;

i though being awkward, nervous, on-edge, and uncomfortable 24/7 was just my personality. i thought my fear of talking to other people and my fear of making phone calls (often to the point of tears) was just me being shy. i thought constant chest tightness and pain was just normal stress. i thought it was normal for the smallest things to be beyond overwhelming. my intense fears of constantly fucking up had been with me for so long that i never thought twice about the rationale behind it. i have adhd as well and when i thought maybe that was the cause of some of it, but when i got my adderall prescription, i wasn't magically cured of all my uncomfortableness. i was still a nervous, anxious person who also happened to be able to focus better than i used to.

&#x200b;

two weeks ago, the feelings became stronger than normal. i had aches in my chest for days on end. i was so nervous and on edge--more so than usual. that happened out of nowhere, then an unexpected loss in the family sent me over the edge in terms of panicking. it dawned on me after the worst had passed that maybe this is an anxiety disorder. i did a lot of self-reflecting and realized maybe i've been anxious all my life and i just never realized it because i thought it was normal.

&#x200b;

&#x200b;

i don't really know what the point of me typing all this out is, but it just feels good to know maybe there's hope for me. i talked to my doctor and was prescribed zoloft last friday. i don't know how much it will change me, i know that it's not some kind of magic pill, but just knowing that i'm not alone and that there's a chance to overcome this is so comforting to me.


edit: i just wanna say thank you all for the kind comments and well wishes! it's so nice to find other people who can relate to what you're going through. i wish you all the best in your own personal journeys as well. ",0
post_04306,"today im 96 days clean and sober I never thought I would make it this far, but here I am, 96 days clean and sober. It's been a challenging journey, but I'm proud of myself for taking this step towards a healthier and happier life. Grateful for the support that has helped me through each day.",0
post_05387,"i can't stop thinking about my toxic ex-best friend i need to get this off my chest because i can't stop thinking about my toxic ex-best friend. we’ve known each other for five years, and we’ve had so many fallouts during that time. even when we weren’t talking, i always felt this overwhelming urge to reach out to him. when i do, it's like a cycle that plays out the same way: the first day is filled with apologies, and he always manages to make me feel really bad about myself. then, for the next two days, it’s like i’m fighting with my boyfriend because i’ve spoken to him again, and i block him after, even though i really don’t want to. i wish i didn’t feel the need to do this.

the thing is, sometimes i just wonder where he is in life now, what he’s doing, but it’s so confusing because he treats me so poorly. he’s always telling me how much of a bad person i am. on top of that, he tries to get between my relationship with my boyfriend. he’s done the same with every girl he’s been in contact with — trying to meddle in their relationships, and yet, i can’t seem to stop myself from thinking about him and feeling that pull to talk to him again.

it’s hard to explain because i promised my parents i wouldn’t have contact with him anymore, but this urge is so strong. it’s like i can’t go long without talking to him, and the missing him part messes with my head. i feel so torn because i know it’s bad for me, but i can’t shake the feeling that i want to reach out.

has anyone been through something similar? how do you break free from this cycle when the urge to reconnect feels so intense, but you know it’s ultimately toxic for you?

",0
post_07012,"lost in the darkness i feel like i'm drowning in a never-ending cycle of pain and despair. everything around me seems to be crumbling, and i can't find a way out. the weight of my past trauma and the struggles i face every day are suffocating me.  my family, who are supposed to be my support system, only add to my misery. the constant criticism, emotional abuse, and lack of understanding make me feel like i'm all alone in this world. i try to reach out for help, but it feels like no one truly cares or understands the depth of my suffering.  i've been carrying these burdens for so long that they've become a part of me. the idea of ending it all feels like the only way to escape this never-ending pain. the thought of not waking up to face another day is both terrifying and strangely comforting.  i long for someone to notice the silent screams behind my smile, to see the darkness that consumes me from within. but it feels like i'm invisible, drowning in a sea of people who are too busy with their own lives to see my struggles.  i don't know what to do anymore. the future looks bleak, and the past haunts me at every turn. the weight of my existence feels unbearable, and the thought of continuing this way is overwhelming. i just want the pain to stop. i just want to find peace, even if it means finding it in the end.",1
post_03484,"i need help differentiating real health problems vs my anxiety please hi i've always been an anxious guy, i'm 18 years old and up to now i've never had any health problems besides heart stuff when i was a baby. this didn't really start to get bad until 2 weeks ago when i ate something that gave me food poisoning, after that i was i didn't know what to eat, i thought everything would give me food poisoning or something else, then last week i randomly got a tight feeling in my chest that i googled and it gave me the worst results like heart attacks and stuff like that, i ended up going to the er where they said i was fine. then i randomly got hit with terrible anxiety the other day and the chills which i chopped up to low blood sugar, it went away after awhile, yesterday though i went to a cafe then had a bit of avocado toast like 2 small bites before i got super anxious because sometimes when i eat avacado by mouth gets super itchy but nothing severe, but the more i thought about it while sitting there i felt as if my throat closed and i got super anxious, nauseous and my eyes started to twitch as if they were swelling or something was wrong with me, i ended up having to pull off to the side of the road to calm myself down, i ended up being ok. then later that night i was driving  and i felt a weird stabbing feeling in my left side of my jaw which i then looked up on to see what the problem was which brought me on a long rabbit hole of nerve damage and things like that, my left eye then started to feel funny and as if it were numb, which really freaked me out and prompted me to look more stuff up about it which brought me to eye strokes, strokes in general, things like that and that made me so anxious and i started to panic and my girlfriend had to calm me down she told me it was just chronic googling and i understand that it's been messing with my head, but i'm still on edge, i feel dizzy and nauseous sometimes, my memory feels like it's not good and i forgot somethings, my minds racing and my words come out funny to me, my left eye feels as if somethings wrong with it but i don't know if it's something to worry too much about and go back to the hospital for, i haven't been sleeping well either so that might be it, i fall asleep every night past 12 and wake up early so that might play a role, i'm just fearful, i just don't know what to do, i know this is long but i need help, thank you ",0
post_04005,"i drove for 20 minutes on the highway by myself!!!! for the first time ever. i have driving anxiety, but i did it!!!!!",0
post_01860,"i hate my appearance and it’s ruining my life  i’m not sure when or why i started hating my face and body so much, but it’s really completely destroyed my life.  i never leave the house, i go to bed at like 7am and wake up at anywhere from 5-8pm most days, and spend hours looking at myself in the mirror and taking photos/videos of myself.  want to get surgery/plastic surgery for a few things (mostly on my weak chin) eventually, but i’ll probably just find new things to hate after the fact.

nobody has ever called me ugly or said anything about my side profile or other things i hate about myself.  my girlfriend thinks i’m entirely in my head about it.  i just feel like i’ll never be happy again.  either i’m crazy and have body dysmorphia or i’m right that i look fucking weird compared to other people and that i’m ugly.  i’m also a dude which makes it hard to take about this stuff outside of a therapist, which i’ve tried and it really didn’t do much.  i’m on antidepressants and have been for about a month or so, but i’ve yet to feel any difference outside of maybe being even more tired than i already am from doing nothing all the time.",0
post_01875,"my rape ruined my life and i can’t escape it anymore after i was raped, i got into a relationship w my best friend and current boyfriend. i love him more than anything and he’s been great for not just my mental health, but he has helped me find hope so many times. 

because of the rape, i ended up creating a fake past where i wasn’t a virgin and ive dated other men. i don’t know why it happened - it’s not excuse at all. my therapist thinks it just happened because i needed a way to cope, so i made up a new past for myself. it just has been painful to watch me be with him knowing ive been a liar and it’s my fault. 

i just don’t know what to do. i cant escape the rape. or my own faults. i have attempted twice. i was hospitalized in a psych facility once and it was horrible. because of the rape, i wasn’t able to walk for two months. it ruined my life and school. i failed two semesters of college and had to redo everything. i just can’t do this anymore. it is too hard and im 20 now - i cant imagine life getting better from this point. 

i just don’t know what to do. i feel like i have nothing left.",0
post_07591,"lost in the abyss i don't know where to turn anymore. it feels like i'm drowning in my own mind, surrounded by darkness that suffocates me. the weight of my past mistakes and traumas is crushing me, and i can't see a way out.  i've been carrying this pain for so long, it's become a part of me. the memories of abuse and neglect haunt my every waking moment, leaving me feeling like a broken shell of a person. i try to put on a brave face for the world, pretending that everything is okay, but inside, i'm falling apart.  i've tried therapy, medication, and reaching out to friends and family, but nothing seems to ease the constant ache in my soul. i feel like a burden to those around me, like i'm dragging them down with my own despair.  the thought of ending it all has been creeping into my mind more and more frequently. the idea of escaping this never-ending cycle of pain and loneliness is starting to feel like the only solace i have left. but a part of me still holds on, hoping for a glimmer of light in this endless darkness.  i don't know if anyone will understand or care. maybe this is just a cry into the void, a desperate plea for someone to see the agony i'm in. i'm so tired of pretending to be strong when all i want to do is crumble. i feel so lost and alone, like",1
post_07090,"i can't find a reason to keep going lately, everything feels like it's crashing down on me. it's like the weight of the world is on my shoulders, and i can't breathe. my family life is a mess, my job is draining the life out of me, and i feel like i have no one to turn to. the loneliness is suffocating me, and i can't see a light at the end of the tunnel. i've been through so much pain, loss, and heartache that the thought of ending it all seems like the only way out.  i see no purpose in continuing this endless cycle of suffering. every day is a struggle, and i'm tired of putting on a brave face for the world when inside, i'm crumbling. the thought of just disappearing, of not having to deal with all this pain anymore, is becoming more and more appealing.  i've tried reaching out for help, but it feels like no one truly understands the depth of my despair. it's like i'm drowning in a sea of emotions, and there's no lifeboat in sight. i don't want to burden anyone with my problems, but i also can't keep going on like this.  i don't know what the future holds, but right now, all i can think about is how much easier it would be to just end it all. i'm tired of fighting, tired of pretending that everything is okay when it's not.",1
post_01923,"i just want to end it i have no reason to live, i have to face the facts, i am not made to live. i just want to die right now, instantly",1
post_01065,"passive suicidal thoughts whenever i'm at a crosswalk and a car is stopped for me, i think of getting them to step on it. whenever i'm at the top of a staircase, i think of letting myself fall down it. whenever i'm at a ledge, i think of stepping over it and hitting the ground below. even though these things probably wouldn't kill me and would just leave me with some horrible injuries, i still can't help but think of them every single day. there's always that ever-so-slight push in the back of my mind trying to guide me into giving up and giving in to these thoughts.",1
