Post_Id,Text,Lable
d4_000016,"i dont know what to do there are 12 days left until my 18th birthday. i've had depression since i was 12, and i've been on controlled medication (venlafaxine and lamotrigine) for about 3 years now.
last year, i accidentally got into the college i wanted, but my family decided to take legal action because i hadn't finished high school yet. i ended up attending college and finishing my last year of high school at the same time until october, when the legal process concluded, and they decided to revoke my spot, even though i was already halfway through the second semester.

that caught me by surprise since i hadn't signed up to reapply for college (since i was already there). i had to sign up quickly, and luckily i made it to the second round.

i spent the last month thinking about how to gather the courage and find methods to kill myself in case i didn't get the spot, but i couldn't come to any conclusion.

today, the admission exam results came out, and i failed. my friend could do it, and her graduation party is on friday, but i don't want to face her or anyone else. honestly, i feel like i'm just a burden to my parents, with the cost of medications, therapy, and private school, which i didn't even have the decency to honor by passing college admission again.

i've lived a short life, but i don't have any major regrets. now all i want is to die in peace, but it seems like dying is so difficult.

i already cut myself today and haven't been able to stop thinking about killing myself in the bathroom by cutting my wrists, but i don't want my parents to see my body. they would probably want to move out of the house, and i don't want to cause too much trouble.

honestly, i found this reddit after searching on google for some forum that teaches a safe and painless method to die, and i ended up writing this. i know some people might think my story is stupid since i haven't committed any heinous crime to justify dying, but honestly, i don't think my life has much value to need a big reason to end it.

i still don't know how i'm going to do it, but i know i don't want to see anyone. i just want to disappear.",1
d4_000017,"does anyone get horrible, horrible heartache that literally is so physically painful? when i'm sad, like really, really, sad, i get these sharp pains in my heart that are continuous and jerk tears. it hurts so much at times that it spreads throughout my body and i flinch and curl up in pain while my tears uncontrollably drop down my cheeks. my stomach hurts, and my whole body begins to ache, my head starts to pound and that's when i find comfort in the idea of ending it all - that there's a way out. thinking about it gives me comfort. writing letters to everyone gives me comfort. until it feels real and it all comes back and i miss people that i love. i miss the way things were and i miss when i didn't fuck everything up. i miss when i was loved unconditionally.",1
d4_000018,"i'm just a wrong investment by my parents  my parents hate each other, i don't understand why i should exist, i can't do anything right, i'm just a waste of time and resources, i have no friends, still a virgin, no one loves me, i just wanted to die quietly, like i never existed",1
d4_000019,unfortunate i just turned 19 and i see no reason to turn 20 id love to but my life just sucks i can't find a job and i'm stuck livin in my granny crib it'll be easier on my whole family if i died suddenly. i hope anyone who reads this can try to be better life's a gift just not for some of us.  :),1
d4_000020,"i think i'm going to kill myself tonight.  i think i'm going to kill myself tonight. i don't really want to die, but it feels like the only way to reconcile the failure i am",1
d4_000021,i feel like i have no other option but to kill myself i can't sh. i don't have any more blades and it would be difficult to buy them but i feel such a strong desire to cut myself. i cut myself to calm down and not kill myself at that moment. and now i don't have it anymore. i promised my girlfriend that i wouldn't kill myself and i intend to keep that promise. but i feel like it's something i can't run away from . and i'm in so much pain and i feel so hopeless that it really feels like there's no other way out. i don't know how to deal with all this. i need help but no one irl cares.,1
d4_000022,"i got a gun to kill myself and my parents found out about it before i could do it. hello, everyone. pretty long rant ahead so grab something if you care to read.

i'm a 17-year-old dude, i live somewhere in north africa, i've been dealing with mental illness for more than 3 years now. i'm kinda traumatized because of all the bullying i've been dealing with since i was young, i don't really get bullied now but i can get verbally hurt as i can't really deal with the other party due to the lack of my social skills. anyways, i didn't have any chance to make a good long-term friendship in my short life. mostly, they get bored of me or i just push them away. i decided to go to a therapist because those problems were affecting me in a very bad way and distracting me from studying. but it didn't help much since the therapist wasn't that good. i decided to cut myself and do other forms of self-harm, whether it's starving myself or purging whatever i ate, etc.. a year later, my parents noticed my unhealthy behavior and decided to take me to a psychiatrist, i was diagnosed then with schizophrenia and severe depression, i began to take medications and they helped me a lot but the side effects were taking away a lot from me, my memory was and still pretty corrupted and i wasn't able to do everyday activity, in addition to blurry vision, vertigo, etc., i was in the last year of high school and exams came so i stopped going to the psychiatrist. i got a really bad grade despite doing my best, i stopped taking my medications cold turkey. i went to a below-average college and my mental state is really declining. i was able to get a pistol but my parents found out about it. my plan was ruined and i'm under some kind of suicide watch. i really can't take it anymore, just everyone telling me to ""man up!"" and ""a lot of people are going through worse"", i'm also kinda guilt-tripped.

i just came here and wrote this from a throwaway account because no one really listens to me, most of my ""friends"" can't really be relied on, and i felt like taking this off my chest. thanks to whoever read the whole thing.",1
d4_000023,"i got the knife in my hand. gonna try and cut myself till i die. goodbye everyone here , thanks y'all for being nicer to me than my own dad. bye <3 farewell, internet strangers. if there is hell or heaven or whatever fairy tail thingy, hope to meet you there.

thanks y'all for bieng good human beings ðŸ’™ðŸ’šðŸ’›â¤ï¸ðŸ§¡

edit: didn't do it. probably will with in this week till next one. i cut and reach dermis. i have a 2 mm gap were i cut. i can't bleed no matter what. my body is to strong. it tries to protect a cut so fast.....

i bled little. i wish i did more. guess maybe next time....

edit 2: im still here.i feel dirty for not doing it.",1
d4_000024,i'm getting closer every day i'm considering ending it all. i've had passive suicidal ideation for months now and it keeps growing. my stresses and triggers keep getting worse everyday and i can't do it anymore. i can do my homework anymore because of how stressed out it makes me and i can't just not do it because i'm stressed over my grades which are already failing. i hate this. i can't do it anymore. i don't have friends to count on. my family is just so dysfunctional right now. i don't have anyone to lean on to and i can't keep going on like this. i've been miserable for years and the suicidal thinking's been getting horrid the past few months. i need to end it.,1
d4_000025,"i did what i could. im a man, not far of 34. i've been here many times before, wanting to die, wanting to end it all. it's hard! so fuuuuuuckkkinngggg hard! i sat in the bath for last hour trying to cut my wrists and end it. i can't. it hurts. i'm a coward.
i've have so many pills available that i can go for right now but i need it to be a certainty, if not, then i cant do it",1
d4_000026,"i really want to be cured and be happy i'm a 31 year old. i have a list of mental health issues: ocd, social anxiety, depression, panic disorder and aspergers syndrome. i didn't ask any of this. i try every day to get better. my whole life i'm dealing with this. i've been to many psychologists, psychiatrists over the years. nothing helped. i'm suicidal every single day. i live in sri lanka and people don't take mental health stuff seriously. most of them are uneducated about this. i was bullied throughout my school years. neighbours, relatives demean me comparing to my successful siblings and my parents. i had panic attacks every single exam since i was 12 and still i did a masters degree. i completed it. i did 2 internships and i tried several jobs but my mental health issues prevent me from doing it. i'm completely burnt out now. i still do freelance work time to time. this is me giving my 100% but to the world, i'm a lazy weirdo who is completely dependent on my parents. they are old now (64 and 69) and they still have to take care of me. my 69 year old dad still has to work because of me. i hate myself so much. my parents don't deserve someone like me. i asked last week if i die will they be okay. my mom cried and said they won't recover from that. so i don't want to die. i want to get cured so badly. i want to take care of my parents, not the other way around. i want to be happy but my brain doesn't allow it.",1
d4_000027,"should i just ditch the note? i was planning on writing a suicide note for my family mainly for the explicit purpose of explaining why i killed myself so that they wouldn't make any stupid assumptions or blame it on something else,but i'm starting to feel like either they'll misinterpret it anyways or it just won't matter.   
  
this is gonna sound incredibly stupid,but i don't want there to be confusion in case my suicide somehow makes news and becomes another stupid study on mental health or whatever. i mean,even if it does,it won't matter since most strangers mourn for a few days before forgetting about it and moving on to the next tragedy or whatever. sorry if this is one of the stupider posts to grace your feeds.",1
d4_000028,"i've worked too hard and too long to have nothing. the first problem is finances. i'm 37 years old and i've been working towards a stable career since i was 18, and every time i specialize in something new, there is a recession or the market plummets for that career.

i have a master's degree and 2 other degrees, experience in multiple professions, speak english and spanish, three years experience as a software developer, got laid off twice, and i can't find a job. i've worked for many years, and this was supposed to be my time to finally at least live comfortably and be able to do things like buy a home and start a family. i've been to college for 11.5 years and have a ton of student loans, and can't get a job no matter what i do. i got laid off my decent paying job back in june because no clients wanted anyone without at least about 8 years of employed experience, and i got hired by another company in november and got laid off again 2 weeks ago because the company decided to combine tasks to one team and shrink the staff because it was slow. i've applied for over 250 jobs recently and not a single interview because they all only want the most experienced people that require no training or assistance.

in addition, i have autism, and the only people i've connected with mostly in the last decade are people who use that to their advantage to get things out of me and then blow me off afterwards. i was helping mentor and be like a parental figure to a friend's children who i really cared about, and after they got what they wanted out of me after claiming i was like a father to them for 5 years, they all the sudden weren't interested in seeing me anymore except for maybe when i was needed to help get them a job or a ride.

i used to have a best friend and i haven't seen her in 9.5 years. she wasn't a friend, she was a best friend. someone i told things to that i never told anyone else. after awhile, she started going through problems and taking them out on me, always losing jobs every week and saying it was someone else's fault, taking anxiety pills and antidepressants while loading up on alcohol, tried college but quit in the middle of the first semester because it was too hard, and eventually just chose not to talk to me at all anymore when i didn't validate her blaming everyone else for what she was going through.

i also volunteered as a host parent for high school exchange students, and i had one really good kid from thailand, but the rest were spoiled, entitled, blamed me for their problems, and eventually made up lies about me just so they can get a family with more luxuries like they pictured such as pools at their house, lots of space, etc.

so, what's really bothering me though, is everything i do succeed or catch a break at ends up being too good to be true. friendships, jobs, other events in life always getting screwed up. every time it appears i'm going to get to the next milestone in life, there is a market collapse, betrayed by someone sociopathic that i thought was my friend, etc.

i honestly just wanna die and i'm planning it. i'm thinking around 3-4 months is my timeframe that i'll go to a hotel, bring a helium tank and make an exit bag, and then let some hotel employee find me after checkout time the next day.

i've been in therapy for years, tried all sorts of medicine combinations, i don't drink or smoke, and nothing helps. i'm saying goodbye because i can't live like this anymore.",1
d4_000029,"my sister wants me to kill myself and i agree with her not only does my sister make me want to kill myself but she's been encouraging it too. she's the cause of so much stress in my life and it's obvious she's the favorite in my family. she's not overweight, she makes good grades, she has a social life, she has friends, she's mentally and physically healthy, *she's neurotypical*..... the list goes on. she's everything my parents wanted me to be but condensed into one child. and she constantly belittles me for it, for not being what my parents wanted, for not being her. it's been getting to a point where my parents might have to choose between having her and having me, and that's not something i want to put on them, especially my mom. but i've been getting close to that breaking point for years now, and i don't know when i'll finally snap. i've been trying to stay alive at least until my favorite franchise ends, but staying alive gets harder and harder every single day. i'm tired of being pelted with rocks in the greenhouse at school. i'm tired of constantly noisy classes and teachers not doing anything about it. i'm tired of having to prove my worth to everyone, i'm tired of working towards a future that is only going to cause me more stress and pain. i'm tired of never being able to sleep. i'm tired of being constantly stressed.    
i just want quiet. i just want to sleep.",1
d4_000030,"even in my happiest moments i'd still rather be dead even in my most euphoric moments where everything is going ""perfect"" and i feel at peace, i'm still always thinking to myself ""i hope i die in my sleep later tonight"" or just fantasizing about some mass extinction event so that i don't have to keep living on. when i'm experiencing something amazing or ""happy"", i'll be thinking wow this is great... but living still won't ever be worth it. it seems impossible to ever be content",1
d4_000031,"my best friend killed himself he was 24. we met when we were teenagers. we were in a romantic relationship for a while, broke up, and then decided to stay friends. he was the only person i could confide in. he faced a couple of setbacks and had a few shitty days and 2 months ago, killed himself. i woke up to a call from his boss saying he didn't show up to work (i was his emergency contact, that's how close we were). i went to his house and found him dead. i wont say what method he used. we were gonna move in together. now i'm alone, i have no friends who i can talk about deep stuff with like i could with him. i saw how he did it and i want to copy him. i can't live the rest of my life with this feeling. i go on the suicide bereavement subreddit every day and see the pain that people are still in 10, 20 years on. i found comfort in knowing there are others who relate at first but now, it doesn't make me feel anything. i feel hopeless. i hated this world anyway even before this happened. it was me and him against the stupid culture we live in. now i'm alone and i'm going to kill myself too.",1
d4_000032,i'm gonna be dead within the next 24 hours  i honestly just hate my life i don't even know what to do im 5'3 at 16 so no girl wants anything to do with me im addicted to porn and i already have my noose tied and ready to go for tomorrow like i want to die so bad i don't even care what happens after you die i just need all this shit to end,1
d4_000033,"it feels like i'm addicted to self-harm. every time i feel sad or something bad happens, i instantly grab sharp objects (a blade, cutter, utility knife, etc.) and cut my legs until they bleed. i've been having suicidal thoughts for almost 7 years now, and they never go away. it feels like my whole life is spiraling downward. i'm scared that harming myself is the only way i can cope with my sadness and emptiness. smoking cigarettes and drinking alcohol don't help much anymore. i don't have friends or someone else to talk to, i also don't have any social skills. i feel so empty, and i'm just living without purpose.",1
d4_000034,"to no one and to all i know i may be too scared to die, but.. everything's just crumbling. i feel so lifeless. it feels like my body has energy, yet i have little to no motivation.

my parents are narcissists, that can't change even in the slightest for their daughter. i'm taking years to get better myself and i've finally reached a place of confidence and analysis that prevents breakdowns.

the only person i can call a friend is not replying to messages that will either make or break the friendship, which is okay, but it also breaks me. waiting is hard. yet he's been so not trustworthy recently.. it feels like he doesn't care. he doesn't really check in on me, even though i'm going through a really rough time. he doesn't plan things with me and initiate those things. he sometimes ignores my messages after asking how i am.. and we talked about how hurtful these things are.. yet, well, we are here. i just need to wait. maybe he's planning to find a replacement or strength to tell me to fuck off.

me and my partner are constantly having issues, we are so so close to breaking up. at times it feels wonderful, during others it feels like breaking up is inevitable. i often fall into idealization and devaluing because he doesn't meet my needs. it hurts. all of it. he is also not very emotionally ""advanced"". he has only started his healing journey. he's suicidal and depressive. i've been in this healing journey for 7-9 years now. we don't match on that. he has so much to learn.. but it's been a year and i feel hopeless on this subject. again, waiting.

waiting is so tiring. it's so stressful.

then there's uni. my uni acts like it's very individualized and cares about mental health. well, that's wrong. they don't care, they're a big institution that care about being advertised as caring, but not really being. and i have 1,5 years of that left. it feels like school all over again. i am so tired of memorizing.. it's so useless. exams and midterms basically only test memory. i am just so tired.. again - waiting. waiting for uni to end.

and then we have the future. the amount of uncertainty, the amount of possible loneliness, the amount of stress and work and bullshit that might or might not happen, or the fact i will need to work my whole life.. all of it is torturous.

not a single thing in my life feels stable. i don't want to be alive, but since i developed an insane fear of death, i am left with hopelessness, living by distractions. there's nothing to rationalize anymore, nothing to analyze. i just want one singular person to be stable and safe. just one. i'm tired of being by myself, i'm tiring of being able to cry mostly only when i'm alone. i'm just tired. i'm tired. waiting.",1
d4_000035,"""painless death"" a big machine that disintegrates your entire body instantly",1
d4_000036,"i could really use some advice with this situation. is it a big deal or no? (sorry, english isn't my first language.)

last night when i was walking home from work, i accidentally found myself walking behind a young woman who was going to her car. since i am tall and quite muscular, i wanted to get ahead of her so as to not freak her out. i started to run a little, but she screamed and fled to her car which was only a couple meters away. needless to say, i feel completely horrible about it and i've felt like shit ever since.

i went home from work earlier today after only working for about ten minutes as the pain was so intense and i couldn't focus on my job. i then attempted suicide which didn't really seem to do anything. ever since, i've desperately wanted some guidance from someone but no one is around to help me out. this probably isn't a big deal, but like i said this has been eating away at me for way too long.

...help?",1
d4_000037,"i want to kill myself to show my friends i'm not just being an attention whore i destroyed my relationships by telling them about my self harm and wanting to kms, they called me an attention seeking little bitch. i want so badly for them to know i'm not",1
d4_000038,people don't give a fuck about you until you're dead. i fucking hate humanity I'm tired of feeling like I have to die for people to care about me. It's frustrating and heartbreaking to realize how little value we seem to place on each other's lives. I wish more people showed genuine care and concern while we're still here.,1
d4_000039,"last night i dreamt that i was happy. i'd forgotten what it felt like. it's a curious thing, really. waking up and realizing just what your life has become. opening your eyes and looking around a room full of the stuff that used to excite you. after years and years of being just barely aware of the passage of time, coming to the stark realization that you have nothing left.

i suppose i should be thankful. i have lived a life overflowing with privilege, and have been just handed over opportunities that most people would have to fight for, and that many never get to have anyway. my parents love me deeply, that i know for a fact. never in my life have i ever had to wonder where my next meal was gonna come from, or whether i would still have a home when the bills came. i've always had it all, and from this treasured oasis of opportunity i have built nothing but this small room filled with broken toys and half forgotten dreams.

i used to feel angry about the life i've wasted. when the anger ran out and i realized there was no one to blame but myself, i felt sad. now the decades have slipped by without ever realizing it, what was supposed to be the best time of my life is now behind me, and now i feel nothing. nothing but a hollow certainty that, just as i longed in my childhood to reach for the stars, now i just long for a quiet funeral, where the very few that cared will mourn and the many that knew my name will soon forget.

after all, time will erase everyone's legacy, eventually. mine just happens to be close to spent.",1
d4_000040,"i posted a joke on twitter so i wouldn't kill myself i was feeling incredibly suicidal.  so i posted a stupid video clip of a screaming cowboy on my twitter all my friends have access to because fuck how awful would it be for that to be the last thing i'm seen posting?

it's stupid and childish maybe. but idk maybe someone else will benefit from hearing it worked for me.  anything to keep me here at this point tbh.",1
d4_000041,i'm going to kill myself i can't do it anymore. i feel desperate. i desperately wanted someone to help me but no one can do anything for me. i wanted to die from a natural death before i do this but it didn't happen. may god forgive me,1
d4_000042,"how do i get out of here how do i get out of my household? how do i go to fostercare? how do i be put up for adoption? i am a child and i want to be adopted by someone else. i want to be in another home. both of my parents abuse me. i just realized i only want to die because i'm stuck with my parents. if i had loving parents i wouldn't want to die anymore. please help me. someone please save me. i'm too scared to tell anyone about what my parents do. i don't have evidence except low quality clips of them yelling at me,. they are good at smoothtalking. i don't want to go to court or deal with government people or crisis services nobody will believe me and i'm scared. once i open my mouth my dad will beat me and he will destroy everything i have. he told me if i tell anyone he abuses me he will smash my computer and phone over his knee. please. i want out of here. can i leave without telling anyone all the details? please, i can't wait 4 more years. please someone anyone please tell me how to leave how do i get new parents i hate my parents please someone help me help help help help",1
