Post_Id,Text,Lable
post_00415,"i find it kinda funny that “normal” people see suicide as unimaginable or something that you’d “never do”. it hits me every once in a while that normal people don’t think about suicide as often as i do. i’m not even actively suicidal right now, but i consider it often enough for me to realize that i’m one of the outliers in society. so, over the years suicide has become more and more realistic, and has almost become a part of my daily life.

what gets me though is how that’s *totally* not the case for everyone else. if you mention suicide, people either freak out or just play it off as a joke as if the concept of “suicide” only exists in movies and books. and while it is sad, i actually find that kind of funny.

for example, i hate working. i fucking hate getting up early to sit at a desk doing shit i don’t want to do for 8 hours straight. but if i tell anyone about that feeling, guess how the conversation will go?

me: man, i really don’t want a job. i wish i could just sit around doing nothing all day.

them: well you need money, don’t you?

me: yeah but i don’t want to get a job.

them: tough, that’s the way the world works, you lazy fuck. you’ve gotta work if you wanna live.

me: well technically i don’t *have* to, because i could just kill myself and not have to deal with it.

them: seriously? you’d rather commit suicide than get a job? that’s pathetic.

me: yep, i’m pathetic. thanks for reminding me, that’s another reason why i should just kill myself.

them: wait, you’re serious? nooooo don’t kill yourself you’re loved and you have so much to live for!!!!

i just find it funny that people don’t consider how all of this bullshit could just stop immediately if i put a gun in my mouth. they’re like “if you don’t want to live by the world’s rules, you don’t get to live at all >:(“

but when i decide “yeah that sounds fair enough, guess i’ll just off myself then :)” their tune changes and they can’t fathom that anyone would choose to not live in this vicious cycle of suffering and guilt.

of course i can’t say any of this shit in real life, because i don’t think this attitude helps in the slightest. it’s nice to think and rant about online, but if i started telling people how i really feel i’d get thrown back into the psych ward. or worse, people i care about would get tired of my moping around and they’d cut me off, and then i’d *have* to go through with it.

everything’s fucked, and the only *”real”* solution i can come up with is just opting out of life. and if i bring it up before actually going through with it, i can only expect to be mocked or bombarded with insincere attempts at “helping”.

isn’t life fantastic? :d",1
post_03623,"anyone here have severe hyper focus on your symptoms? i have gad and pure o. im so obsessed with my symptoms that it drives my gad crazy, i know ever feel relief when i sneeze. feels like my brain lets go for a few seconds only for my brain to refocus again. im just so tired, tried all the antidepressants, benzos only help the physical and gad issues but does nothing for the obsessive part.",0
post_04956,"i think i’m done i (19 f) don’t think i can do better than what i’m doing right now. everyday is a struggle and i can’t take it. as pathetic as it sounds, my lifeline is my cats. they’re the only reason i haven’t committed yet. but my mom and i just had a huge argument. she kicked me out. i don’t know when i can come back, if at all. i have no one to talk to. my stepdad who was helping me through dealing with my mom, is ignoring me now and i don’t know why. he was the only one i could talk to. i’m too scared to talk to my friends. i’m sleeping over at a friends house tonight. but they just think it’s cause i needed space. not because i can’t go back. i want to see my cats. i want to hold them. but i don’t know if my mom will let me. i think i can’t do anything else from here. i am a full time college student, working 30 hours a week on top of that. and in my area, i still can’t afford even a studio apartment. i have nowhere to go. and no one to talk to. i think this is it ",0
post_02453,"lolcow made me loose my faith in humanity not that i had much to begin with
but i saw some posts about a influencer i know and one of the comments said that they had a lolcow


having never heard of that before i googled it and it's basically a bunch of people coming together in a 4chan kind of thread to systematically document and make fun of every little step a specific person does


the things that are said there are so fucking disgusting it's sickening
i know there were awful people in this world but how sad does your life need to be to participate in these disgusting threads.


humanity can be so ugly and cruel


this makes me wanna cut myself i dont even know man
",0
post_03206,"is this really a time for me to take a break from the news? i've taken a two day break, and i'm feeling a little on edge. with all the crazy things happening, i feel like i'm missing important things. i'm just so scared. i'm in the us btw. 

edit: thanks for the help. i'm feeling better about it now. :)",0
post_06303,"my daughter has no idea how the things she does impact my life took my daughter on vacation and ended up getting screwed out of our place to stay once we arrived, costing hundreds and hundreds of dollars in car, gas, hotel, food, the works. we cleaned out the kitchen before we left so as to not come home to any old food, and upon returning home, i was sweating trying to figure out what we were even going to have for dinner our first night back.

i came back from an errand to find she'd made spaghetti for dinner, with seasonings and sauce, the works.

i didn't ask her, i didn't say anything about dinner, but she took it upon herself to make sure dinner was ready when i got home.

as a single parent, that means more to me than a three course gourmet meal at the best place in town and these simple things make my heart just explode.

edit: my first ever gold! thank you, kind stranger!!!

edit 2: i am bawling my eyes out reading your comments thank you all so much <3 she is absolutely my everything and i know how lucky i am to have her

edit 3: for those asking ""why doesn't she know"" or saying i should tell her, it isn't that i don't tell her. i try to do so all the time. i just know she doesn't fully grasp the effect she has on my life merely because she doesn't have the proper frame of reference to understand. i didn't know the effect i had on my own mother until i became a parent in my own right, and knowing what i knew then vs now, there's no way i could comprehend it properly.
i can tell someone a million times that they're beautiful but they might not believe it until something actually clicks in their mind. that's what's happening here as well.",0
post_04249,in elementary school when we would read outloud from the textbook i would literally count the kids in front of me and figure out what section i was reading so i could practice it before it got my turn so i wouldn't mess up.. and i think that's where my anxiety started.,0
post_02035,"i almost died yesterday i almost did it yesterday. i skipped school and went into the woods with some alcohol and a rope and i planned to end my life. i tied the noose and i jumped from a tree. miraculously my neck didn’t break and and a homeless man came out of nowhere and cut me down. in that second that i was hanging from the tree all i could think about was how much of a mistake it was. i spent the rest of that day talking with the homeless man and learning about his experiences and i realized that life has its ups and downs but that’s what life is, you gotta live through the pain because it’s all experiences, not good or bad experiences, just experiences. thank you, mike, if you are reading this. ",1
post_01651,"i think i’m gonna do it tonight made a post earlier about not knowing exactly how to kill myself but i think i figured it out. i think i’m gonna do it tonight. 

hopefully it doesn’t hurt but eh. as long as i’m dead i don’t really care lol. i’ve got the note written out and everything. i’m just scared that one of my siblings will find my body. they’re so young. i don’t want to traumatize them. my bedroom door is locked but they know how to open the door without a key. 

how can i prevent them from finding my body? and if i fail, will it leave bruises on my neck? i don’t want anyone to see. i’m going to try to hang myself with a rope dog leash (the strongest rope i could find lol) ",1
post_00811,"i wanna kill myself i don’t see any point in life, i do not want to improve and the only reason i’m holding back it’s because i have a thing to help my mom to do, but in 15 days i’ll end my life. ",1
post_05231,"boyfriend (25m) called me (27f) attention seeker wanted to get this off of my chest since i have no one to talk to. i wanted comfort but what i got was hurtful words. 

what do you do when your boyfriends toxic personality slowly shows up again?
he said before that he will never do it again, but yet he did it — say hurtful words to me. 
he’s busy with work but idk if my feelings are valid i just needed someone to talk to.
his work has a lot of free time, i know it because we are in the same field. but he is so focused yet i understand but idk he cant give 1 or 2 minutes of his time 
i just said only if you have free time yet he says hurtful words to me hence he called me i am an attention seeker.
im at the lowest point of my life, ive lost a loved one few days ago, he knows ive been through my darkest days for the past few days and yet i dont know if im just sensitive from all the hurtful words i received from him. 
i remembered when i found out my loved one has few days left, he didnt comfort me the way i wanted to. he just stared at me and waited for me to talk, saying just accept it. he doesnt wanna sugar coat things because he isnt like that (thats what he told me)
all i needed was his comfort — hug or saying everythings gonna get better. but i didnt received any.

now he said his sorry but i feel it wasnt sincere. 
i dont have anyone to talk to. :(",0
post_02016,"i have no hope. there is no point in living in this society. wear myself out working for a pathetic living when i know i’ll never be happy? god i might as well shoot myself. 

the only good thing in my life is my partner and i am even pushing them away. if i’m really going to do it,i need to get my shit together and push them away further so that i can end this miserable life, but im selfish and they are the only thing that has been making me happy. 

i pray every day for it all to end ",1
post_02717,"i don’t know if i depressed or not i just have a lot of thoughts about ending my life i always thinking that i will never do it but this time i feel that iam weaker now , i even have a plan to do it, i imagine myself do it hundred of times , is this okay? will i be okay ? 
my life is okay i am doing well in my life, iam single have my family around me have a stable job , why will i do it ? 
if you see me in real life you would never thinking that i have these feelings or thoughts 
but i hate this feeling, feeling that if i end my life everything will be okay and better 
because how could that be better ?",1
post_00239,"i am worthless and just wanna end it. today, my anxiety is so bad. i was in the hospital for a while for blood loss cuz i’m sick. my biopsy isn’t until another few weeks.


i’ve attempted a few times i don’t know why i’m still alive, first time i was in a coma, another time a friend found me, i had an nde, another time i was rushed to the hospital when i jumped off a cliff. somehow i’m still here. i survived cancer. now i might be battling again.

i did my part in life, i treated others with kindness, i never did drugs, i treated others with fairness, i never drank except 8 years ago when i suffered depression and never really liked getting drunk so much.
i went to college and graduated. i did my part in life. even if i get yelled at or bullied by others.

ever since losing my job and becoming homeless i never found my purpose. it’s been almost 2 years this year. the only thing i have is my son. he visited me at the hospital and hugged me and told me he misses and loves me.

but the thing is, i have nothing. no matter how much i look for work, no matter what i do, i get nothing. my son’s mom yells at me, people get angry at me, even if i’m just helping people out i get yelled at. they say stop being so nice or pretending to be nice. i was angry a long time ago and i hated being angry or even being pushed to breaking.

what do i do? i can’t provide for my kid, i can’t even find a job at a fuckin fast food, or even wash cars cuz of my condition. they say find help here and there, every call, nothing. no help.

i wanted to freeze to death, might be simple since i have no where to go. my car’s gone, it was down for a while and i can’t even get the money for repairs completely. my car was income doing deliveries. i have nothing and i’m crying asking god why i’m still alive and asking what my purpose is on this earth. my son probably sees me as a loser who’s homeless. i’m ashamed to be his father. no matter what i do to spend time with him or even see him.

i pray daily for a miracle to turn my life around but there’s nothing for me at all. i’m hoping it’s cancer again so it can eat me alive. even thinking maybe i should just either freeze outside these single digit temps, or try to jump again at the park’s cliff. my anxiety and depression is so high. i just wanna end it so no one has to suffer seeing me like this.

i miss my uncles and grandma. i just wanna see them again in heaven. they’re the only ones in my life that made me happy besides my son. i know if i don’t die tonight, it’ll be closer than ever. 

my uncles all died my age.",1
post_05293,"my parent is cheating and i’m sick of it i (24) f, live with my parents to save money. my parents have been married for 20+ years. i found out my father was cheating on my mother when i was younger, but now it’s starting to affect me mentally since i live with them. my parents refuse to get divorced. i was trying to find my phone a few moments ago and i used his phone. i saw a tinder and bumble notification by accident. also, his instagram is like, 90% women in lingerie. he asked me to find a photo for him on his phone one time, and his photo gallery is 50% filled with half naked girls. i am tired of pretending like this isn’t happening and dissociating. however, i’m not sure if it’s my place to say anything. i am a grown adult living with them. my mother is aware that he cheated on her in the past. i asked her why she doesn’t want to divorce, but she says she is worried he will kill himself if we leave him alone due to this depression. he is a good father and i am just super sad and depressed over this. and people wonder why i don’t want to be married, let alone be in a relationship. because of shit like this. thanks for reading. ",0
post_04367,"does anyone else experience a good day, and then one thing happens and sends you into the downward spiral of self-loathing/sadness? edit: thank you got all your awesome stories and relatable comments! all of you should feel like superheroes, you gave me the will to get out of bed this morning :)",0
post_05466,"future plans i genuinely don’t think i want kids. just want to make as much money as possible, get a dog and travel. a parter would be nice but i’m completely ok not ever having kids. ",0
post_02604,"i can't keep fighting like this  yall i'm only 25 and life just keeps getting worse. i don't know what to do. i'm alone and scared and i don't want to be here anymore, i keep arguing with some version of myself in my head about the reasons to stay and why they don't exist  ",1
post_06165,"americans wearing shoes in the house is absolutely disgusting they’ll wear their outside shoes over carpet, on the couch, in their bedrooms, on the bed, in the kitchens, all over their house. it absolutely makes no sense. you’re tracking all the outside dirt and filth into where you sleep/eat. i know this isn’t all states but it seems like it’s most of them and it makes no sense. why america.",0
post_04797,"fuck fuck fuck fuck fuck fuck fuck fuck fuck fuck fuck fuck fuck f

u

c

k

t

h

i

s

s

h


i

t",0
post_01917,"my moms lies are going to ruin my life again. i think i might just give up i am mentally ill. i am struggling. i have heart pains and my doctors appointment is in march. all my mom does is lie. its literally constant. she's told our landlord her mom died three times and then will hang up and show her disgusting smile with her rotting foul teeth like what she did was okay. all in the name to get the bill payday pushed back a day or two even though i have the money.

its pathetic. she's told the government so many lies which will affect me eventually. shes told food stamps me and my sister dont live with her, although the houses rent is in my sisters name. and all our documents list that we live in the house. shes told the insurance that we don't work at all or go to school, not a single bit despite us being mid-early twenties. to the landlord we only work a few hours a week because we're lazy. to our housing voucher (they pay half of rent) i barely work because im a terrible lazy daughter and they dont like me.

the web of lies has gotten so tangled the insurance, food stamps, and housing voucher (state worked), are asking us what's going on.

i need therapy. im not doing well. i need medication, i am constantly losing my mind. all i hear is her screaming at me that i'm doing something wrong. i grab the wrong thing at work? ""oh my fucking god you dont ever ***listen*** . its the left one. you fucking i swear to god."" im not working nearly enough to pay all of rent, food, therapy, and to keep saving up to move out and get my own car. my heart is starting to give up. i feel it. i can sense it's starting to fail me and my body is showing signs something severe is happening.

im scared i will lose my insurance and just. die. before i can move out, and have my first car and have my first apartment and just everything. or i get out and im able to do it but i'm still slowly dying or something.

her lies have ruined so so much of my life. she's a compulsive liar and has npd and she refuses to accept it. she refused to listen to her therapist to which she swiftly dropped because of it.

i feel so lost. what if i have a heart disease and i need medicine or i'll die? then what? i have been avoiding getting this checked for years because i know no one cares about *me*. but i'm now trying now that i know i can move out someday and save myself. but i dont know anymore. maybe i will just keep letting my heart stay in daily pain and accept it'll kill me",0
post_02753,"i hate dentists for making me suicidal 4 months ago i got 2 wisdom teeth extracted from the right side of my face. my 4 wisdom teeth were fully erupted,but the dentist insisted on taking them out,because they would be hard to clean. i said i wanted more time to think about it,but they insisted that it was an emergency and need to be taken out immediately. after the removal of this wisdom teeths i got tmj on the right side of my face and i can't find a solution for this. also, my face became asymmetrical which made my self-esteem worse...",0
post_00110,"i want to feel joy and my body doesn't want to feel at all. i really want a reason to stay here. i look at my husband and he is a reason. then we get into a fight and now i'm not so sure what my purpose is. not because of the fight but because of patterns that have been happening in my life. 

someone comes into my life and loves me a little then one day they decide that they want to shit on me. they don't just decided to shit on me but it feels that way. every day my body is sad. every day i want this, whatever this is, to not be so hard, so easy. easy to know why i don't want to be here. because it's easy to know why i don't want to be here right now and the scary thing is i can't find many reasons to stay here anymore. i don't want to be here anymore. i don't want to exist. everything would be so much easier if i wasn't here.

things wouldn't be coincidental. i wouldn't even need or want to matter. i don't matter. i don't and i never will.",1
post_00573,"i'm really tired i am so exhausted. 

six months ago my ex blind sided me with a breakup, one week after getting my dream job. he demanded to live in the house with me for six months as roommates, which i initially felt that i had to agree to. five days later i found out he had already reactivated his account on tinder, with new images and everything. five days and he's already over a five year relationship. i forced him to move out and after the biggest argument we've ever had he moved back into his parents house. 

he has proceeded to live a great life and harrass me every now and then for certain things. he wants me to pay him everything he put into the mortgage to give me the house but i can't afford it alone. selling it, he wants to profit, and feels entitled to more than what he should have. i'm too exhausted to fight him. 

for the last six months, my job has been my entire life, but my life is shattered. i've struggled. i've done brilliantly at work but really sometimes found it hard to get out of bed. some days, i knew if i got in the car i would drive it into a tree. but work, obviously, wouldn't understand that. i have not passed my probation period. 

i have nothing left. i feel empty. i feel hollow. i am so, so tired. i have nothing left to give. it would be better to just die and let him have the house. my parents would love my animals. they'd be okay without me. i wouldn't be tired anymore. ",1
post_04323,"does anyone else feel like they're constantly in a rush to get things done even when they have nothing else they want to do? i don't know if this is anxiety linked or not but ive always has this sense to rush things. i always want to get things done and completed, even enjoyable things sometimes. 

like i want to move on to the next thing or i just want to finish things so i can relax.

but then when i have nothing to do i don't have anything i even want to do. i feel like it's really hard for me to just enjoy what i'm doing whether it's good or bad, work or fun, etc. 

i've read of ""hurry sickness"" but it feels like that matches people that are actually busy and want to do more things. im not really a busy person, it's like i'm in a rush to get back to doing nothing.",0
post_00745,i’m so desperate i’ve (17m) gotten to the point where i get so little attention from women that i wish to be kidnapped and abused by one so i can actually feel something other than depression. i harm myself everyday imagining that it’s a girl doing it to me and it feels so good. i just want to die. ,1
post_01043,"it fucking hurts to know that not even your own mind accepts you. It's a constant battle, fighting against the negative thoughts and self-doubt that plague my mind. It's painful to feel like even my own thoughts are against me, making it hard to find peace within myself.",0
post_05421,"i’m cursed..? i don’t know what’s wrong with me.
my whole life i have a history of being clumsy absent minded and generally rough on things, living and inanimate. i break things often, bump into or knock things over, i’m drowning in debt at the age of 24, i’ve moved across the country time and time again due to circumstances i found myself in because of this, keeping up with basic every day tasks like cleaning, parenting, hygiene, budgeting, etc is often an insurmountable task. i call it goblin dna. my boyfriend compares it to living with a velociraptor. i just wrecked my car for the 3rd time this month, now it’s totaled. i feel like my brain doesn’t operate on the same level or with the same capacity as everyone else. it’s becoming a serious issue but i don’t even know what the issue is..?? i’m a little (a lot) dumb and clumsy? i mean is this something that can be medicated? how do i fix it? in desperate. thanks for reading. ",0
