Post_Id,Text,Lable
post_07578,"lost and alone - drowning in pain it feels like my life is falling apart at the seams. the weight of my struggles is suffocating me, and i can't see a light at the end of this dark tunnel. i've been battling my inner demons for so long, and it's becoming harder to keep fighting.  every day is a war against my own mind. the loneliness engulfs me, and the emptiness in my heart feels endless. i try to reach out to friends, but they don't understand the depth of my pain. it's like i'm screaming into a void, and no one hears me.  the thought of ending it all has been lingering in my mind like a poisonous whisper. i feel like i'm standing on the edge of a cliff, and the urge to let go is getting stronger with each passing day. the world feels too heavy, and i'm so tired of carrying this burden.  i just want the pain to stop. i want the tears to dry up, and the numbness to fade away. but it feels like there's no way out, like i'm trapped in this cycle of despair with no escape in sight. i don't know how much longer i can hold on.  i'm lost, broken, and consumed by darkness. i need a lifeline, a glimmer of hope to hold on to. but right now, everything feels bleak and hopeless. i'm drowning in my own sorrow, and",1
post_03566,"i feel like i’m lagging behind in life due to anxiety after i graduated from university, i struggled through all my jobs, all corporate jobs, and i just couldn’t deal with the high stress environment. i was a high performer in school and even though i had anxiety back then i could still cope well. when work started, i felt so lost and alone, everything was too overwhelming. i quit a few jobs because i couldn’t cope due to my severe anxiety and i finally started going to therapy. 

however, things have not gotten much better. i’m still unable to cope and i just quit my job again. this time, i’ve decided that the corporate environment is just not suitable for me, and will be trying to look for jobs in other fields that might be better for my anxiety. 

however, i’m starting to feel very depressed and lost. in a few years i’m going to be 30, and that scares me so much, because i still haven’t gotten my life together. i know some may say everyone is different and has their own pace, but i still feel so useless. 

i’m afraid that i won’t be able to find a job that i can actually cope with, and i don’t know how i’ll be able to sustain myself as i get older. my friends from high school and university are all doing well, and i’m the only one who seems to be utterly useless. 

sometimes i feel like ending it all because it all seems so bleak and pointless. ",1
post_03242,"supplements for anxiety what are the best supplements for anxiety? surely there is something other than medication/treatment to help?

i don't have severe anxiety, just mild symptoms because of work stress.",0
post_00612,"being gay is a curse. an affliction. the only cure for it is leaving  i was gay since i was very little,  before i even knew what it was or had seen or heard of it as a concept. i remember i was like 6 or 7 and the commercial for the first harry potter movie came in the tv and i had my first little crush. i had crushes like that until around 11 or 12 when i hit puberty, then the physical changes happened and i really knew what i was. and i knew what gay was by then but from then on, until 8th grade,  every day i'd tell myself ""don't worry, you're fine, this won't last, you'll be normal soon"". i'd also pray every night for ""god"" to make me normal. when i got to 8th grade, i realized it wasn't a phase and there was no ""god"" who was going to cure me.  that's the time i had suicidal ideation.

every year that went by,  the more i learned and experienced just how despised my kind are by most people. and every year i felt worse and worse. and i learned to hate myself at the very core. there's part of me that every time i look in the mirror, all i see are every single words that people think of me as. i'm a blight that's infecting this world. i'm a demonic, satanic, degenerate, perverted, sick fucking freak who has no place here. it doesn't even matter if i believe it or not,  the fact is most people in this world do, and that's all that matters. to them, i am one of the worst things one can possibly be and i am incompatible with a good society and a threat to the very foundation of family. 

i have other issues as well, typical life bs. no friends, hardly any family. still don't have  a career. fat. the place i'm in right now with all that is mostly my fault, i see that now. i've sabotaged myself so many times are purposefully wrecked so many good opportunities because of that self hatred i hold. its like i could never allow myself to succeed because i don't think i deserve it.  and i guess i don't. 

throughout the years i've had small slivers of hope or moments where i tried to just push through and live the best i can. i went back to school this past semester to try and do what i've always wanted to. but then the election happened and it truly cemented what i've always known. in a way it's a good thing, like a band aid being ripped off. they want me gone and it kind of makes it easier because i know that leaving actually makes so many people truly happy. there's tons more of my kind out there but at least i'm doing my part. i dropped my classes, quit my job and i'm just wrapping things up. before spring is ideal..there's something really comforting about the cold and earlier darkness.

also it really fucking pisses me off and makes me think about life and what this all is, if anything. i never asked to be what i am. i didn't want to be a homosexual, i never chose it. the natural opinions of us by the vast majority of people make it clear that we shouldn't exist. i'm just unlucky that i end up with this infliction. despite all of that, it's still hard to actually do but i know it's the only option that makes sense. it's inhumane that safe, legal options aren't available to leave ",1
post_07755,"lost in the darkness the weight of the world is crushing me. it's like i'm constantly drowning and no one seems to notice. the pain in my chest just keeps growing, and i can't shake off this feeling of hopelessness. every night, i lie awake with the thoughts of ending it all swirling in my head like a never-ending storm.  i've been struggling for so long, and i can't see a glimmer of light at the end of this never-ending tunnel. it's like i'm trapped in a cycle of despair, and no matter what i do, i can't break free.  the loneliness is suffocating. it's like a heavy blanket that wraps around me, making it hard to breathe. i feel like i'm invisible, like no one truly sees me for who i am. the world keeps moving, but i'm stuck in this endless void of emptiness.  i just want the pain to stop. i want the darkness to lift, but it feels like there's no way out. i'm so tired, so broken. i don't know how much longer i can go on like this.",1
post_07218,"lost in a sea of darkness  i don't know how much longer i can keep swimming in this sea of darkness that's slowly consuming me. no matter how hard i try, the waves of despair keep crashing over me, dragging me further down. it feels like i'm suffocating, like there's no air left for me to breathe.  i've tried everything to stay afloat - therapy, medication, reaching out to friends and family - but nothing seems to make a difference. it's like i'm trapped in a never-ending nightmare, and there's no waking up from it.  the loneliness is suffocating, the pain is unbearable, and the hopelessness is overwhelming. i feel like i'm standing on the edge of a cliff, ready to jump, just to escape the torment of my own mind.  i don't see a way out of this darkness. the thought of ending it all is starting to feel like the only option left. i'm tired of fighting, tired of pretending that everything is okay when it's not. i just want the pain to stop.",1
post_05741,"im 18 and i feel like i already fucked my life im 18, last year in high school, my academic kinda shitty, not that im stupid i just can't study i just pass classes with the minimum, i already saw and done shit a 18 year old shouldn't, i just feel like i threw all my life away, i wanna change and be better but it's just too much and i don't know what i should even do and it just makes me feel empty and like a fucked up shit, i've been an alcoholic i've been smoking for 10 fucking years i saw people stab my friends i saw my friend go into jail i was chased vy fucking police, i just don't know how to fix shit up how to be better and i've tried so many time just to fall back into the same deep dark hole over and over ",0
post_06816,"i watched another man fuck my wife and i think it gave me ptsd my wife of 9 years approached me about 3 years ago about opening our relationship and trying polyamory. originally, she wasn't interested, so far as i knew, in seeing anyone else. i'm bisexual and because we got together and had kids at a very young age, i never really got to experience that side of myself. i've always been open and honest with her about it, though and she was super supportive and open minded about, and knew that it was something i wanted to explore but couldn't really ask her for. 

she gave me a few ground rules, like no women, shower afterwards, always use protection, and always come home to her afterward. i was okay with that. over the next couple years, i only had a few very minor sexual encounters with guys from grindr. there wasn't even full-on intercourse, with a single exception. two years ago, i was raped by a guy i had gotten to know and let my guard down. it was pretty traumatic and horrible, but it was over very quickly, and i did some counseling and felt like i had mostly gotten over it. my wife was supportive about the whole thing, but after that i pretty much completely stopped meeting guys. i'd still chat on grindr sometimes, but less out of a desire to hookup than to simply engage with similar people. 

sorry, i'm totally rambling. i don't really know where this story starts and ends, just that it's all jumbled in my head and i need to get it off my chest.

anyways, about 6 months ago j entered our life, as a long time friend of a mutual friend of ours, and he started hanging out with our friend group. i could tell immediately that he and her had chemistry, but i also knew that he was bi as well, and he was really flirty with both of us. the idea was floated between my wife and i that we might approach him about having a 3 way. 

eventually, a night came where he was at our home drinking with us and one other friend. i approached my wife saying ""hey, i think that might happen tonight"" and she responded that no, she wasn't ready for that. i said okay, then we'll pump the breaks on it. 

i got caught up in conversation with the other friend for several minutes, and then noticed j and my wife were both missing. i went upstairs, and found them in our bed - he was eating her out. he sat up and asked if i wanted to have a 3 way. i said sure. 

what happened next wasn't a 3 way. i basically just watch this man fuck my wife. and they were both extremely enthusiastic about it. we had condoms, but he didn't use one and she didn't ask him to. to be fair, i didn't bring it up either. i tried to engage a couple times, but was kinda awkwardly shifted away. eventually he finished and went to piss, and i tried to embrace my wife and she full on shoved me away and said ""what do you want?"" j came back and they fell asleep entwined together, while i slept on the edge of the bed. 

over the next couple weeks, my whole life fell apart. turns out, my wife was never interested in being open and honest about her feelings for him, and now wouldn't communicate with me at all. every time i tried to talk to her, she would ignore me and start texting people. i was miserable, and these weeks turned into a super toxic and chaotic clusterfuck. 

long story short, she told me to leave. all i had was a car that desperately needed repairs, a cooler for some food, some camping gear, and the clothes on my back. i didn't even have a job, because i had left mine to homeschool the kids during covid so that she could keep her career. the idea was that i'd just take a trip so that we could both clear our heads. she agreed that she wouldn't use that time to see j, and i'd have a home to come back to - because i couldn't afford to take the trip now and also move out when i got back. i was already getting low on savings. 

i ended up staying with some friends of mine on the other side of the state for about a week. i came back into town after 5 days, but she told me she wasn't ready for me to come home, so i had to stay in my grandparents spare room for a couple days. out of curiosity, i drove by her place and j's and sure enough, she was staying the night with him. 

i came home after that. i told her that she can fuck around and cheat and lie, but that i was done being forced out of my own home. if she wants time alone, she can fuck off. and, she did. she took the kids, packed up some bags, and went to her parents'. i've been staying at home alone with the cat in the month since. 

we did eventually meet and agree that she'll keep the apartment (i can't afford it alone with the new job i just got 2 weeks ago) and i'll move into a friend's spare room in the next town over. i'll get to come over and see the kids on saturdays while she's at work and i have the day off, but i don't have the space to take half custody of them. 

a couple days ago, i got word from another of our mutual friends that i was no longer welcome at the friend group's bimonthly hangouts, because my presence would make her and j uncomfortable. 

i feel so completely broken. i'm grieving the loss of my best friend and wife, the loss of my kids, my home, and my friend group. i don't understand what i did to deserve this. i'm attractive, intelligent, thoughtful, kind, and genuine, but now i feel so completely worthless. 

i'm going through training at this new job, but i'm having so much trouble focusing. the team lead puts on pandora so we can listen to music while we work, and she listens to the same genre of music that my wife does. my wife makes playlists specifically to help her deal with emotions, and many of the songs that have been playing are super fresh and feel like they've been pulled out of my wife's playlists of the last couple months. the team lead told my i can skip any song i don't like, but i haven't been able to communicate with her that i need to listen to a different station entirely. 

earlier today the coworker next to me kept tapping her foot, and the rhythm rubbing of her clothing fabric made me think of a bed creaking, which brought the image of j fucking my wife to my mind, and then i couldn't get it out of my head. i basically had to internalize the fact that i was having what felt like an anxiety attack. is this what ptsd is like? 

anyways, i was supposed to finally move on saturday and scheduled a u-haul rental, but all the people who said they'd help me move bailed except for one. thanks again, friends. i think i'm just going to cut all these people out of my life anyways. i don't want anything to do with any of them any more. honestly, the only thing keeping me from putting a bullet in my brain is the thought of leaving my two little boys without a father, but even that sentiment is starting to wane.",1
post_07072,"feeling utterly alone and helpless i feel like i'm drowning in a sea of despair, with no one reaching out a hand to save me. every day is a struggle to even get out of bed, facing the same overwhelming loneliness and hopelessness that suffocate me. the weight of my past mistakes and traumas hangs heavy on my shoulders, dragging me down deeper into the abyss.  i've tried reaching out to friends and family, but they just don't seem to understand the depth of my pain. they tell me to ""just cheer up"" or ""things will get better,"" but how can they possibly comprehend the darkness that clouds my every thought? the smile i force upon my face is just a mask to hide the turmoil within.  every happy moment i witness in others only serves as a stark reminder of the joy that eludes me. it's like a cruel joke, watching others revel in their happiness while i'm drowning in sorrow. the thought of a future seems like a distant fantasy, one that i may never reach.  i find myself contemplating the finality of it all, wondering if the pain will ever cease if i were to end it. the allure of escaping this torment is tempting, offering a reprieve from the endless suffering that engulfs me. but a part of me yearns for a sliver of hope, a glimmer of light in this suffocating darkness.  i just needed to share these thoughts with someone who may understand",1
post_06069,"my best friend was 91 when she died. edit: thank you for all the love and support. i can't reply to everyone because i'll just start tearing up again and i can't have the floodgates open when i'm working. but know it's very much appreciated and i'm so happy to hear many of you have friends like this in your lives <3

she was born in 1916 and i was born in 1992. i was 6 when i first met her in my neighborhood and loved to come over. her husband died the year before i met her and she told me so many stories that i felt like i knew him. her life was just as interesting and i adored hearing the things she did during her best years.

we'd play cards, listen to the radio, tell jokes, bake (and eat plenty of cookie dough). she wasn't like a grandmother to me, she was just a really good friend. i don't believe there are any pictures of us, but if there were then they have been lost in time.

i moved houses, but stayed in the same town and could visit her at least once per week by riding my bike over. we moved a little further a few years later and the visits were a couple times per month with a few calls in between.

i was 14 when a stranger called my house and asked for me. i never talked on the phone, so my mother was suspicious who it was. once she asked, the woman on the phone introduced herself as the woman's grand-daughter. she was calling because her grandmother had passed and she wanted to let me know.

i got a hug and then the subject never came up again. i missed my friend and people around me didn't think it mattered. i never knew why. her family didn't even contact me for the service or anything. it hurt.

i think about her every few months and everything comes flooding back. she gave me high expectations for a friend and i admit i've compared possible friends against her several times. i'm hoping that when travel restrictions are lifted, i can go to her grave. she buried next to her husband and love of her life. i can't wait to meet him.

i guess i just miss my friend.",0
post_00394,"sometimes i wish i didn't have people who would be affected by my hypothetical suicide. I know it's a dark thought, but sometimes the weight of my struggles feels unbearable, and I wish I didn't have to consider how my actions would impact those who care about me. It's a lonely and overwhelming feeling, but I'm trying to hold on and find reasons to keep going.",1
post_02729,"i get suicidal when i see people doing better than me i don't get motivated, all i do is keep falling and the abyss",1
post_04561,"anyone else not sold on partially re-opening states? it doesn’t seem like anything is actually getting better. 

more like people just feel tired of being locked in. 

partially re-opening doesn’t mean people are automatically safe again. 

it’s not like the problem is going to disappear after apr. 30.",0
post_00158,"i dont know what´s happening with me. i just can't look ahead and see myself in the near future. it's like there's a big slime inside my own chest and i'm only going to be able to get it out by sacrificing myself. it's ridiculous, but honestly i just haven't tried to kill myself before because i don't know how to do it. i have no reason to hold on to absolutely anything.",1
post_02830,"i'm not going to commit suicide, but i'd like to die. i have no hope. let me start by saying that i'm not going to commit suicide, but i'd like to die. i have no hope in a variety of ways.

i'm on government disability benefits and i can't work. there is just too much stuff wrong with my brain. if anyone cares i made a writeup at https://github.com/johnreedlol/essay_for_disability , but basically there is so much unfixable stuff with my brain that it looks like i will never work in the future.

you'd think this is a dream come true, but i have no friends or partners. i spent maybe 15 years trying to get a girlfriend unsuccessfully. i give up. i just want to be a recipient of physician assisted suicide.",1
post_05548,"why is ever 3rd redditor autistic i feel like everyone on reddit now is like""this is my story... but i'm autistic soooo"" i think people are just lying because no one can fight them if they say that.",0
post_01622,"i don’t want to be here any longer i just want to fade away peacefully.  i’m tired of life and “living”.   the only thing keeping me semi-sane was my relationship of 20 years.  well, that ended yesterday and i don’t feel the need to be here any longer.  life has always ben rough but it’s gotten rougher.  i just want to be done.",1
post_04760,"today is my twelfth day sleeping on time and eating all 5 meals well, 2 weeks ago i made a post on this sub, venting a bit what was going through my mind at the time.
i was very anxious and stressed, eating poorly and very little even sometimes just once a day. my nights were very particular, sometimes sleeping less than 4 hours a day every day.

today concludes the second week in which i sleep early and wake up comfortably. besides complying with 5 meals a day, especially breakfast which i missed so much.
i went back to exercising, playing the guitar, playing chess online.

i still have a lot to do, and although the current situation is not the best i can say that i am ready to go back to work with a positive mindset!",0
post_03149,"breathing stuffed animals vs weighted stuffed animals sorry, i didn’t know which flair to put this under. i just want to know if anyone uses those breathing stuffed animals or weighted stuffed animals? i can’t sleep at night due to my anxiety, i sleep better when i’m sleeping with someone (a.k.a. my boyfriend, but i can’t sleep with him every night) i saw on tiktok a breathing otter stuffed animal. i looked it up on amazon and i found a bunch of little breathing toys. i also found some weighted toys. i just want to know if you’ve tried them, a) if they work and b) which option seems better. i tried to find weighted and breathing ones, but i didn’t see any. 

thanks!",0
post_01072,"tomorrow i’m going to get help  tomorrow i’m going to wake up and wait until my house is empty, im going to sit on the floor with my favourite knife and mark the arteries on my wrists with a pen. i’ve dreamed of actually slicing and bleeding out and finally being free but i wont be doing this tomorrow. tomorrow i will get help.

i’ll call an ambulance and tell them what i plan to do, the operator will stay on the phone with me until the ambulance arrives and i’ll be sectioned. i’ll be helped. 

i know lots of people will think that sounds even worse but i promise u id be happier in a psychiatric ward than my current life. 

i guess ill update?",1
post_01432,"what is there to live for? the simple answer to this question would be for myself, my goals in life, for a better future. or to say that i should live for someone else. family, friends, a lover, a pet.
but what if i don’t have any of that? what if i have no friends, no lover, no pets of my own, a family on the brink of kicking me out because i’m broke and despite all my attempts still jobless after a month.
i can’t say i want to live for myself because i hate myself. i have tried to live for myself and i just became more depressed. 

everyday i wake up and i wish i didn’t. i am drowning little by little and at this point i am too far gone to ever be able to climb my way out of my debts. it’s shameful of me to want to die and leave my family behind with my mess but i am not able to handle it by myself and a families kindness only goes so far. i’m stuck. i’m sinking further and further with each passing moment. i can’t do this any more. i don’t want to do this anymore.
",1
post_00810,"the only meaning of life quote that makes any sense the literall meaning of life is whatever you're doing that prevents you from killing yourself.

- albert camus",1
post_04385,"[humour] how we were made Growing up, my parents always joked that I was made from sunshine and rainbows because of my cheerful disposition. But as I've gotten older, I've come to realize that I am truly a mix of all the love, laughter, and lessons that have shaped me into the person I am today. And for that, I am grateful.",0
